# Screenshots – Internship diary (until 11/02/2026)

All screenshots for the Daily Diary are stored here.

## Week-ending dates (diary sections)

Use these names when saving a screenshot for each week:

| Week ending (Sunday) | Suggested filename |
|----------------------|--------------------|
| 17/08/2025 | `week_2025-08-17.png` |
| 24/08/2025 | `week_2025-08-24.png` |
| 31/08/2025 | `week_2025-08-31.png` |
| 07/09/2025 | `week_2025-09-07.png` |
| 14/09/2025 | `week_2025-09-14.png` |
| 21/09/2025 | `week_2025-09-21.png` |
| 28/09/2025 | `week_2025-09-28.png` |
| 05/10/2025 | `week_2025-10-05.png` |
| 13/10/2025 | `week_2025-10-13.png` |
| 20/10/2025 | `week_2025-10-20.png` |
| 27/10/2025 | `week_2025-10-27.png` |
| 02/11/2025 | `week_2025-11-02.png` |
| 09/11/2025 | `week_2025-11-09.png` |
| 16/11/2025 | `week_2025-11-16.png` |
| 23/11/2025 | `week_2025-11-23.png` |
| 30/11/2025 | `week_2025-11-30.png` |
| 07/12/2025 | `week_2025-12-07.png` |
| 14/12/2025 – 25/01/2026 | `week_2025-12-14_to_2026-01-25.png` |
| 01/02/2026 | `week_2026-02-01.png` |
| 08/02/2026 | `week_2026-02-08.png` |

## In your diary (Markdown)

Link a screenshot in `Daily_Diary_Internship_Report.md` like this:

```markdown
![Week ending 31/08/2025](screenshots/week_2025-08-31.png)
```

## Current contents

- **94** images were copied here from Cursor assets, named `screenshot_0001_YYYY-MM-DD.png` … `screenshot_0094_YYYY-MM-DD.png` (by file date).
- You can rename any of these to the week filenames above, or add new screenshots with the suggested names.
